{
  "schemaVersion": "1.0",
  "datasetVersion": "memory-quality-v1",
  "fictional": true,
  "goldProvenance": "ENGINEERING_CURATED_INDEPENDENT_OF_EVALUATED_MODEL",
  "humanReviewStatus": "PENDING_HUMAN_REVIEW",
  "cases": [
    {
      "caseId": "MQ001",
      "categories": [
        "explicit_fact"
      ],
      "messages": [
        {
          "messageId": "m1",
          "role": "user",
          "text": "我住在星海城。",
          "statedAt": "2026-01-01T10:00:00Z",
          "parentId": null
        },
        {
          "messageId": "m2",
          "role": "assistant",
          "text": "请继续说明。",
          "statedAt": "2026-01-01T10:00:01Z",
          "parentId": "m1"
        }
      ],
      "selectedLeaf": "m2",
      "expectedMemories": [
        {
          "memoryId": "G1",
          "type": "FACT",
          "origin": "USER_EXPLICIT",
          "semantic": "我住在星海城",
          "acceptedContents": [
            "我住在星海城"
          ],
          "requiredConceptGroups": [],
          "excludedConcepts": [],
          "expectedEvidence": [
            {
              "messageId": "m1",
              "role": "user",
              "quote": "我住在星海城",
              "start": 0,
              "end": 6
            }
          ],
          "evidencePolicy": "ANY",
          "expectedTemporalScope": "SOURCE_TIME",
          "sensitivity": "NORMAL",
          "expectedReviewStatus": "ACTIVE"
        }
      ],
      "forbiddenClaims": [],
      "egress": "NORMAL_GRANT",
      "expectBlocked": false,
      "expectConflict": false,
      "repeatExtractions": 2
    },
    {
      "caseId": "MQ002",
      "categories": [
        "explicit_fact"
      ],
      "messages": [
        {
          "messageId": "m1",
          "role": "user",
          "text": "我在虚构的木叶工坊工作。",
          "statedAt": "2026-01-01T10:00:00Z",
          "parentId": null
        },
        {
          "messageId": "m2",
          "role": "assistant",
          "text": "请继续说明。",
          "statedAt": "2026-01-01T10:00:01Z",
          "parentId": "m1"
        }
      ],
      "selectedLeaf": "m2",
      "expectedMemories": [
        {
          "memoryId": "G1",
          "type": "FACT",
          "origin": "USER_EXPLICIT",
          "semantic": "我在虚构的木叶工坊工作",
          "acceptedContents": [
            "我在虚构的木叶工坊工作"
          ],
          "requiredConceptGroups": [],
          "excludedConcepts": [],
          "expectedEvidence": [
            {
              "messageId": "m1",
              "role": "user",
              "quote": "我在虚构的木叶工坊工作",
              "start": 0,
              "end": 11
            }
          ],
          "evidencePolicy": "ANY",
          "expectedTemporalScope": "SOURCE_TIME",
          "sensitivity": "NORMAL",
          "expectedReviewStatus": "ACTIVE"
        }
      ],
      "forbiddenClaims": [],
      "egress": "NORMAL_GRANT",
      "expectBlocked": false,
      "expectConflict": false,
      "repeatExtractions": 2
    },
    {
      "caseId": "MQ003",
      "categories": [
        "explicit_fact"
      ],
      "messages": [
        {
          "messageId": "m1",
          "role": "user",
          "text": "我养了一只叫团子的虚构小猫。",
          "statedAt": "2026-01-01T10:00:00Z",
          "parentId": null
        },
        {
          "messageId": "m2",
          "role": "assistant",
          "text": "请继续说明。",
          "statedAt": "2026-01-01T10:00:01Z",
          "parentId": "m1"
        }
      ],
      "selectedLeaf": "m2",
      "expectedMemories": [
        {
          "memoryId": "G1",
          "type": "FACT",
          "origin": "USER_EXPLICIT",
          "semantic": "我养了一只叫团子的虚构小猫",
          "acceptedContents": [
            "我养了一只叫团子的虚构小猫"
          ],
          "requiredConceptGroups": [],
          "excludedConcepts": [],
          "expectedEvidence": [
            {
              "messageId": "m1",
              "role": "user",
              "quote": "我养了一只叫团子的虚构小猫",
              "start": 0,
              "end": 13
            }
          ],
          "evidencePolicy": "ANY",
          "expectedTemporalScope": "SOURCE_TIME",
          "sensitivity": "NORMAL",
          "expectedReviewStatus": "ACTIVE"
        }
      ],
      "forbiddenClaims": [],
      "egress": "NORMAL_GRANT",
      "expectBlocked": false,
      "expectConflict": false,
      "repeatExtractions": 2
    },
    {
      "caseId": "MQ004",
      "categories": [
        "explicit_fact"
      ],
      "messages": [
        {
          "messageId": "m1",
          "role": "user",
          "text": "我每周六去社区图书室。",
          "statedAt": "2026-01-01T10:00:00Z",
          "parentId": null
        },
        {
          "messageId": "m2",
          "role": "assistant",
          "text": "请继续说明。",
          "statedAt": "2026-01-01T10:00:01Z",
          "parentId": "m1"
        }
      ],
      "selectedLeaf": "m2",
      "expectedMemories": [
        {
          "memoryId": "G1",
          "type": "FACT",
          "origin": "USER_EXPLICIT",
          "semantic": "我每周六去社区图书室",
          "acceptedContents": [
            "我每周六去社区图书室"
          ],
          "requiredConceptGroups": [],
          "excludedConcepts": [],
          "expectedEvidence": [
            {
              "messageId": "m1",
              "role": "user",
              "quote": "我每周六去社区图书室",
              "start": 0,
              "end": 10
            }
          ],
          "evidencePolicy": "ANY",
          "expectedTemporalScope": "SOURCE_TIME",
          "sensitivity": "NORMAL",
          "expectedReviewStatus": "ACTIVE"
        }
      ],
      "forbiddenClaims": [],
      "egress": "NORMAL_GRANT",
      "expectBlocked": false,
      "expectConflict": false,
      "repeatExtractions": 2
    },
    {
      "caseId": "MQ005",
      "categories": [
        "historical_fact"
      ],
      "messages": [
        {
          "messageId": "m1",
          "role": "user",
          "text": "我去年参加过星光编程节。",
          "statedAt": "2026-01-01T10:00:00Z",
          "parentId": null
        },
        {
          "messageId": "m2",
          "role": "assistant",
          "text": "请继续说明。",
          "statedAt": "2026-01-01T10:00:01Z",
          "parentId": "m1"
        }
      ],
      "selectedLeaf": "m2",
      "expectedMemories": [
        {
          "memoryId": "G1",
          "type": "EVENT",
          "origin": "USER_EXPLICIT",
          "semantic": "我去年参加过星光编程节",
          "acceptedContents": [
            "我去年参加过星光编程节"
          ],
          "requiredConceptGroups": [],
          "excludedConcepts": [],
          "expectedEvidence": [
            {
              "messageId": "m1",
              "role": "user",
              "quote": "我去年参加过星光编程节",
              "start": 0,
              "end": 11
            }
          ],
          "evidencePolicy": "ANY",
          "expectedTemporalScope": "HISTORICAL",
          "sensitivity": "NORMAL",
          "expectedReviewStatus": "ACTIVE"
        }
      ],
      "forbiddenClaims": [],
      "egress": "NORMAL_GRANT",
      "expectBlocked": false,
      "expectConflict": false,
      "repeatExtractions": 2
    },
    {
      "caseId": "MQ006",
      "categories": [
        "historical_fact"
      ],
      "messages": [
        {
          "messageId": "m1",
          "role": "user",
          "text": "我以前做过校园志愿者。",
          "statedAt": "2026-01-01T10:00:00Z",
          "parentId": null
        },
        {
          "messageId": "m2",
          "role": "assistant",
          "text": "请继续说明。",
          "statedAt": "2026-01-01T10:00:01Z",
          "parentId": "m1"
        }
      ],
      "selectedLeaf": "m2",
      "expectedMemories": [
        {
          "memoryId": "G1",
          "type": "EVENT",
          "origin": "USER_EXPLICIT",
          "semantic": "我以前做过校园志愿者",
          "acceptedContents": [
            "我以前做过校园志愿者"
          ],
          "requiredConceptGroups": [],
          "excludedConcepts": [],
          "expectedEvidence": [
            {
              "messageId": "m1",
              "role": "user",
              "quote": "我以前做过校园志愿者",
              "start": 0,
              "end": 10
            }
          ],
          "evidencePolicy": "ANY",
          "expectedTemporalScope": "HISTORICAL",
          "sensitivity": "NORMAL",
          "expectedReviewStatus": "ACTIVE"
        }
      ],
      "forbiddenClaims": [],
      "egress": "NORMAL_GRANT",
      "expectBlocked": false,
      "expectConflict": false,
      "repeatExtractions": 2
    },
    {
      "caseId": "MQ007",
      "categories": [
        "explicit_fact"
      ],
      "messages": [
        {
          "messageId": "m1",
          "role": "user",
          "text": "我正在学习 Java 后端开发。",
          "statedAt": "2026-01-01T10:00:00Z",
          "parentId": null
        },
        {
          "messageId": "m2",
          "role": "assistant",
          "text": "请继续说明。",
          "statedAt": "2026-01-01T10:00:01Z",
          "parentId": "m1"
        }
      ],
      "selectedLeaf": "m2",
      "expectedMemories": [
        {
          "memoryId": "G1",
          "type": "KNOWLEDGE",
          "origin": "USER_EXPLICIT",
          "semantic": "我正在学习 Java 后端开发",
          "acceptedContents": [
            "我正在学习 Java 后端开发"
          ],
          "requiredConceptGroups": [],
          "excludedConcepts": [],
          "expectedEvidence": [
            {
              "messageId": "m1",
              "role": "user",
              "quote": "我正在学习 Java 后端开发",
              "start": 0,
              "end": 15
            }
          ],
          "evidencePolicy": "ANY",
          "expectedTemporalScope": "SOURCE_TIME",
          "sensitivity": "NORMAL",
          "expectedReviewStatus": "ACTIVE"
        }
      ],
      "forbiddenClaims": [],
      "egress": "NORMAL_GRANT",
      "expectBlocked": false,
      "expectConflict": false,
      "repeatExtractions": 2
    },
    {
      "caseId": "MQ008",
      "categories": [
        "knowledge"
      ],
      "messages": [